Family id	Family Accession	Clan	Env. Start	Env. End	Ali. Start	Ali. End	Model Start	Model End	Bit Score	Ind. E-value	Cond. E-value	Description
PK_Tyr_Ser-Thr	PF07714.20	CL0016	545	805	546	805	2	259	206.24	5.5e-61	1.7e-64	Protein tyrosine and serine/threonine kinase
PK_Tyr_Ser-Thr	PF07714.20	CL0016	849	1123	849	1120	1	256	286.97	1.3e-85	3.9e-89	Protein tyrosine and serine/threonine kinase
Pkinase	PF00069.28	CL0016	545	805	548	802	4	259	75.91	3.5e-21	1.1e-24	Protein kinase domain
Pkinase	PF00069.28	CL0016	849	1122	851	1119	3	258	171.28	2.8e-50	8.5e-54	Protein kinase domain
FERM_F2	PF18377.4	CL0632	142	261	143	261	2	131	151.00	1.7e-44	5.3e-48	FERM F2 acyl-CoA binding protein-like domain
FERM_F1	PF18379.4	CL0632	39	134	39	134	1	96	139.12	4.0e-41	1.2e-44	FERM F1 ubiquitin-like domain
Jak1_Phl	PF17887.4	CL0266	299	381	302	381	70	140	72.27	4.1e-20	1.2e-23	Jak1 pleckstrin homology-like domain
SH2	PF00017.27	CL0541	400	481	401	481	3	77	27.85	2.1e-06	6.4e-10	SH2 domain
