Family id	Family Accession	Clan	Env. Start	Env. End	Ali. Start	Ali. End	Model Start	Model End	Bit Score	Ind. E-value	Cond. E-value	Description
ABC_tran	PF00005.30	CL0023	500	646	500	646	1	137	101.73	4.9e-29	9.9e-33	ABC transporter
ABC_tran	PF00005.30	CL0023	1309	1449	1310	1448	2	136	90.00	2.0e-25	4.2e-29	ABC transporter
ABC2_membrane_3	PF12698.10	CL0181	27	419	32	419	6	346	100.83	8.8e-29	1.8e-32	ABC-2 family transporter protein
ABC2_membrane_3	PF12698.10	CL0181	909	1220	970	1219	100	343	47.91	1.1e-12	2.2e-16	ABC-2 family transporter protein
AAA_21	PF13304.9	CL0023	565	676	600	673	220	297	33.63	3.7e-08	7.5e-12	AAA domain, putative AbiEii toxin, Type IV TA system
